{"asset_ref":{"asset_id":"ast_00000000000000ag","library_id":"prj_0000000000000001","server_id":"6f1c2a52-3c2e-4d4b-9a57-0b6f6f0c1d2e","version_id":"ver_00000000000000v1"},"bounds_max":["0.5","0.5","0.5"],"bounds_min":["-0.5","-0.5","-0.5"],"collision":null,"default_grounding":"FOLLOW_TERRAIN","footprint_radius_m":"0.8","forward_axis":"+Z","height_offset_range_m":["-0.1","0.5"],"kind":"model3d","licence":{"name":"CC0-1.0","rights_verified":false},"material_slots":[{"role":"surface","slot_id":"body","surfaces":{"godot_static_source_v1":[{"node_path":"Body","surface":0}],"portable_glb_v1":[{"mesh":0,"primitive":0}]}}],"placement_anchor":["0","-0.5","0"],"preview_warnings":[],"scale_range":["0.5","2"],"schema_version":1,"source_provenance":{"generator":"assetstudio-integration-fixtures","method":"procedural","note":"Godot 4.7.2 text format 4: embedded ArrayMesh, external .tres material typed Material"},"units":"m","up_axis":"+Y"}