{"asset_ref":{"asset_id":"ast_00000000000000ad","library_id":"prj_0000000000000001","server_id":"6f1c2a52-3c2e-4d4b-9a57-0b6f6f0c1d2e","version_id":"ver_00000000000000v1"},"bounds_max":["2.2","2.75","2.2"],"bounds_min":["-2.2","0","-2.2"],"collision":null,"default_grounding":"FOLLOW_TERRAIN","footprint_radius_m":"2.3","forward_axis":"+Z","height_offset_range_m":["-0.1","0.5"],"kind":"model3d","licence":{"name":"CC0-1.0","rights_verified":false},"material_slots":[{"role":"surface","slot_id":"walls","surfaces":{"godot_static_source_v1":[{"node_path":"Shell/Walls","surface":0}],"portable_glb_v1":[{"mesh":0,"primitive":0}]}},{"role":"surface","slot_id":"roof","surfaces":{"godot_static_source_v1":[{"node_path":"Shell/Roof","surface":0}],"portable_glb_v1":[{"mesh":0,"primitive":1}]}}],"placement_anchor":["0","0","0"],"preview_warnings":[],"scale_range":["0.5","1.5"],"schema_version":1,"source_provenance":{"generator":"assetstudio-integration-fixtures","method":"procedural","note":""},"units":"m","up_axis":"+Y"}