{"asset_ref":{"asset_id":"ast_00000000000000ae","library_id":"prj_0000000000000001","server_id":"6f1c2a52-3c2e-4d4b-9a57-0b6f6f0c1d2e","version_id":"ver_00000000000000v1"},"bounds_max":["0.5","2","0.5"],"bounds_min":["-0.5","0","-0.5"],"collision":null,"default_grounding":"FOLLOW_TERRAIN","footprint_radius_m":"0.6","forward_axis":"+Z","height_offset_range_m":["-0.1","0.5"],"kind":"model3d","licence":{"name":"CC0-1.0","rights_verified":false},"material_slots":[{"role":"emissive","slot_id":"crystal","surfaces":{"godot_static_source_v1":[{"node_path":"Gem","surface":0}],"portable_glb_v1":[{"mesh":0,"primitive":0}]}}],"placement_anchor":["0","0","0"],"preview_warnings":["custom_shader_approximated"],"scale_range":["0.5","2"],"schema_version":1,"source_provenance":{"generator":"assetstudio-integration-fixtures","method":"procedural","note":""},"units":"m","up_axis":"+Y"}